index,url,valid,domain,title,description,image,published,archive,content,quote,language,keyword
https://www.faz.net/aktuell/gesellschaft/wetter-in-deutschland-der-erste-schnee-ist-da-accg-200242732.html,https://www.faz.net/aktuell/gesellschaft/wetter-in-deutschland-der-erste-schnee-ist-da-accg-200242732.html,0,www.faz.net,Wetter in Deutschland: Der erste Schnee ist da,"Polare Kaltluft sorgt in dieser Woche für kühle Temperaturen, in manchen Regionen sogar für Schnee. Im Erzgebirge kam schon der Winterdienst zum Einsatz.",https://media0.faz.net/image/w1200h627/c94dba7e3c95/w3000h1567x0y460o/202511/43601.0.1494190258/zu-wochenbeginn-hat-es-in.webp,2025-11-18T13:58:48Z,,Zum Wochenstart hat es in manchen Regionen Deutschlands geschneit. In den kommenden Tagen geht es dann mit den Temperaturen schrittweise nach unten und wieder ist mit Schnee zu rechnen. Angesichts de… [+3638 chars],,de,'glatte Straßen'
https://www.tagesspiegel.de/gesellschaft/panorama/wetter-neuschnee-frost-und-glatte-zur-wochenmitte-14880419.html,https://www.tagesspiegel.de/gesellschaft/panorama/wetter-neuschnee-frost-und-glatte-zur-wochenmitte-14880419.html,0,www.tagesspiegel.de,"Wetter: Neuschnee, Frost und Glätte zur Wochenmitte","Winterliche Woche in Deutschland: Im Harz gibt es weiter Neuschnee, im Süden wird es frostig kalt. Auch im hohen Norden könnte etwas Schnee fallen.",https://www.tagesspiegel.de/images/14880416/alternates/BASE_16_9_W1400/1763526614000/wintereinbruch-im-harz.jpeg,2025-11-19T04:30:15Z,,Nach einem gebietsweise weißen Wochenbeginn können sich die Menschen in Deutschland in einigen Region weiterhin auf etwas Neuschnee einstellen. In den zentralen und westlichen Mittelgebirgen soll es … [+824 chars],,de,'Glätte'
https://www.zeit.de/news/2025-11/19/wintereinbruch-im-norden-schneeregen-und-glaettegefahr,https://www.zeit.de/news/2025-11/19/wintereinbruch-im-norden-schneeregen-und-glaettegefahr,0,www.zeit.de,Wetter im Norden: Wintereinbruch im Norden: Schneeregen und Glättegefahr,Hier finden Sie Informationen zu dem Thema „Wetter im Norden“. Lesen Sie jetzt „Wintereinbruch im Norden: Schneeregen und Glättegefahr“.,https://img.zeit.de/news/2025-11/19/wintereinbruch-im-norden-schneeregen-und-glaettegefahr-image-group/wide__1300x731,2025-11-19T06:56:54Z,,"Es wird es frostig im Norden: Am Mittwoch herrscht nasskaltes Wetter in Mecklenburg-Vorpommern und Schleswig-Holstein. «Über die 5-Grad-Marke kommen wir bis zum Wochenende nicht hinaus», teilte der D… [+1039 chars]",,de,'Glätte'
https://www.stern.de/gesellschaft/regional/hamburg-schleswig-holstein/temperaturen-um-null-grad--deutscher-wetterdienst-warnt-vor-glaette-im-norden-36822854.html,https://www.stern.de/gesellschaft/regional/hamburg-schleswig-holstein/temperaturen-um-null-grad--deutscher-wetterdienst-warnt-vor-glaette-im-norden-36822854.html,0,www.stern.de,Temperaturen um null Grad: Deutscher Wetterdienst warnt vor Glätte im Norden,Kiel/Offenbach (lno) - Der Deutsche Wetterdienst warnt vor glatten Straßen sowie Fuß- und Radwegen am Donnerstagmorgen in Schleswig-Holstein. In den,https://image.stern.de/36822856/t/BU/v1/w1440/r1.7778/-/19--c3blrzpnf7v3axs2048jpeg---19a3b1ee348a76cd.jpg,2025-11-19T14:01:48Z,,"Kopiere den aktuellen Link
Zur Merkliste hinzufügen
Glättegefahr am Morgen: Der Wetterdienst warnt vor eisigen Straßen in Schleswig-Holstein. Die erste Stadt im Land erinnert an die Streupflichten.… [+1554 chars]",,de,'Glätte'
https://www.stern.de/gesellschaft/regional/baden-wuerttemberg/wetterbericht--bis-zu-20-zentimeter-neuschnee-ueber-nacht-moeglich-36822870.html,https://www.stern.de/gesellschaft/regional/baden-wuerttemberg/wetterbericht--bis-zu-20-zentimeter-neuschnee-ueber-nacht-moeglich-36822870.html,0,www.stern.de,Wetterbericht: Bis zu 20 Zentimeter Neuschnee über Nacht möglich,"Mit feuchtkalter Polarluft bringt Tief ""Talat"" Schnee und Glätte nach Baden-Württemberg. Wo Autofahrerinnen und -fahrer besondere Vorsicht walten lassen sollten.",https://image.stern.de/36822872/t/oy/v1/w1440/r1.7778/-/19--qlerpysvbkv5axs2048jpeg---dc476413c0245b42.jpg,2025-11-19T14:05:08Z,,"Kopiere den aktuellen Link
Zur Merkliste hinzufügen
Mit feuchtkalter Polarluft bringt Tief ""Talat"" Schnee und Glätte nach Baden-Württemberg. Wo Autofahrerinnen und -fahrer besondere Vorsicht walten… [+1301 chars]",,de,'Glätte'
https://www.zeit.de/news/2025-11/19/glaette-bremst-laster-in-suedthueringen-aus,https://www.zeit.de/news/2025-11/19/glaette-bremst-laster-in-suedthueringen-aus,0,www.zeit.de,Straßenglätte: Glätte bremst Laster in Südthüringen aus,Hier finden Sie Informationen zu dem Thema „Straßenglätte“. Lesen Sie jetzt „Glätte bremst Laster in Südthüringen aus“.,https://img.zeit.de/news/2025-11/19/glaette-bremst-laster-in-suedthueringen-aus-image-group/wide__1300x731,2025-11-19T14:50:40Z,,"Neuschnee und Glätte haben zahlreichen Lastwagenfahrern in Südthüringen zu schaffen gemacht. Im Kreis Sonnberg blieben einige Lastwagen an Steigungen hängen, wie die Polizei mitteilte. Verkehrsbehind… [+384 chars]",,de,'Glätte'
https://www.stern.de/gesellschaft/regional/thueringen/strassenglaette--glaette-bremst-laster-in-suedthueringen-aus-36823124.html,https://www.stern.de/gesellschaft/regional/thueringen/strassenglaette--glaette-bremst-laster-in-suedthueringen-aus-36823124.html,0,www.stern.de,Straßenglätte: Glätte bremst Laster in Südthüringen aus,Sonneberg (th) - Neuschnee und Glätte haben zahlreichen Lastwagenfahrern in Südthüringen zu schaffen gemacht. Im Kreis Sonnberg blieben einige Lastwagen,https://image.stern.de/36823126/t/7V/v1/w1440/r1.7778/-/19--aa5rtda4suv3axs2048jpeg---cb3d805823ceb26d.jpg,2025-11-19T14:50:40Z,,"Kopiere den aktuellen Link
Zur Merkliste hinzufügen
Neuschnee sorgt für Probleme: Mehrere Lastwagen kommen an Steigungen in Südthüringen nicht weiter. Größere Unfälle blieben laut Polizei jedoch au… [+547 chars]",,de,'Glätte'
https://www.zeit.de/news/2025-11/20/zahlreiche-unfaelle-auf-glatten-strassen,https://www.zeit.de/news/2025-11/20/zahlreiche-unfaelle-auf-glatten-strassen,0,www.zeit.de,Schnee und Frost: Zahlreiche Unfälle auf glatten Straßen,Hier finden Sie Informationen zu dem Thema „Schnee und Frost“. Lesen Sie jetzt „Zahlreiche Unfälle auf glatten Straßen“.,https://img.zeit.de/news/2025-11/20/zahlreiche-unfaelle-auf-glatten-strassen-image-group/wide__1300x731,2025-11-20T08:18:20Z,,"Auf glatten Straßen haben sich in Niederbayern seit dem Morgen viele witterungsbedingte Unfälle ereignet. Im Einsatzbereich des Präsidiums seien mindestens 50 Unfälle gezählt worden, sagte eine Poliz… [+752 chars]",,de,'Frost'
https://www.bild.de/news/inland/unfaelle-sperrungen-schnee-sorgt-fuer-chaos-auf-deutschlands-strassen-691eb60e39cf5e52053e9b16,https://www.bild.de/news/inland/unfaelle-sperrungen-schnee-sorgt-fuer-chaos-auf-deutschlands-strassen-691eb60e39cf5e52053e9b16,0,www.bild.de,"Räumfahrzeug gerammt, Autobahn gesperrt - Winter legt Frühstart hin – und Verkehr lahm","Schneefall verursacht Chaos: Unfälle, Straßensperrungen und Zugausfälle in mehreren Bundesländern.","https://images.bild.de/691eb60e39cf5e52053e9b16/8a21255c44009034e2f87d4ab21cd9c6,23d796a6?w=1280",2025-11-20T09:13:19Z,,"Meinerzhagen (NRW)/Suhl (Thüringen) Kalendarisch ist noch Herbst, doch der erste winterliche Schnee bedeckt die Straßen im Land. In der Nacht und am Morgen schlitterten Lkw in die Leitplanken, Autos … [+2236 chars]",,de,'Schnee Räumfahrzeug'
https://www.tagesschau.de/inland/wetter-winter-schnee-niederschlag-100.html,https://www.tagesschau.de/inland/wetter-winter-schnee-niederschlag-100.html,0,www.tagesschau.de,"Frost, Schnee und Schneeregen bis ins Flachland","Schnee, Frost und glatte Straßen: In Deutschland bleibt es auch in den kommenden Tagen winterlich. Vor allem im Flachland müssen sich die Menschen auf nassen Schneefall einstellen. Am Wochenende kann sich die Sonne wieder zeigen.",https://images.tagesschau.de/image/b1a88312-d868-49d1-a8dd-1515b788f480/AAABmqCz5do/AAABmgWmh8Q/16x9-big/schnee-590.jpg?width=1280,2025-11-20T10:28:34Z,,"Stand: 20.11.2025 11:28 Uhr
Schnee, Frost und glatte Straßen: In Deutschland bleibt es auch in den kommenden Tagen winterlich. Vor allem im Flachland müssen sich die Menschen auf nassen Schneefall e… [+2256 chars]",,de,'glatte Straßen'
