index,url,valid,domain,title,description,image,published,archive,content,quote,language,keyword
https://www.tagesspiegel.de/gesellschaft/reise/wer-will-schon-im-schnee-urlaub-machen-zum-beispiel-dieser-franzosische-fotograf-14582738.html,https://www.tagesspiegel.de/gesellschaft/reise/wer-will-schon-im-schnee-urlaub-machen-zum-beispiel-dieser-franzosische-fotograf-14582738.html,0,www.tagesspiegel.de,Wer will schon im Schnee Urlaub machen?: Zum Beispiel dieser französische Fotograf,Sind Winterferien überhaupt Urlaub oder doch nur Überlebenstraining auf technisch hohem Niveau? Die Bilder von Christophe Jacrot helfen bei der Wahrheitsfindung.,https://www.tagesspiegel.de/images/14582705/alternates/BASE_16_9_W1400/1761815336000/p-171-photo-christophe-jacrot-winterland-teneues-2025-helleren-norway.jpeg,2025-11-03T09:33:30Z,,"Es lässt sich nicht leugnen: Der Winter steht vor der Tür. Die Temperaturen sinken, die Berliner Sonne schaltet in ihren Kellermodus. Sechs Monate Grauzeit stehen bevor, unterbrochen vielleicht von e… [+6104 chars]",,de,'Schnee Eis'
https://www.stern.de/familie/den-garten-winterfest-machen--so-schuetzen-sie-pflanzen---moebel-9021214.html,https://www.stern.de/familie/den-garten-winterfest-machen--so-schuetzen-sie-pflanzen---moebel-9021214.html,0,www.stern.de,"Kalte Jahreszeit: Den Garten winterfest machen: So überdauern Ihre Pflanzen Frost, Eis und Schnee","Nicht nur Pflanzen, sondern auch Gartenmöbel leiden im Winter. Wenn Sie im Frühjahr keine bösen Überraschungen erleben wollen, sollten Sie Ihren Garten zeitnah winterfest machen.",https://image.stern.de/9021216/t/I1/v6/w1440/r1.7778/-/garten-winterfest-machen-neu.jpg,2025-11-03T11:29:00Z,,"Kopiere den aktuellen Link
Zur Merkliste hinzufügen
Nicht nur Pflanzen, sondern auch Gartenmöbel leiden im Winter. Wenn Sie im Frühjahr keine bösen Überraschungen erleben wollen, sollten Sie Ihren … [+7664 chars]",,de,'Schnee Eis'
https://www.n-tv.de/panorama/Franzoesisches-Skigebiet-Ceueze-baut-alle-Skilifte-ab-article26137568.html,https://www.n-tv.de/panorama/Franzoesisches-Skigebiet-Ceueze-baut-alle-Skilifte-ab-article26137568.html,0,www.n-tv.de,Klimawandel raubt den Schnee: Französisches Skigebiet Céüze baut alle Skilifte ab,In den 1930er-Jahren nimmt das französische Skigebiet Céüze seinen Betrieb auf. Doch an Skifahren ist in dem Ort schon lange nicht mehr zu denken. Es fehlt schlicht der Schnee. Am Dienstag macht das Skigebiet daher Nägel mit Köpfen und stellt sich neu auf.,https://www.n-tv.de/img/incoming/crop26137596/0881322235-cImg_16_9-w1200/469540363.jpg,2025-11-03T12:43:28Z,,In den 1930er-Jahren nimmt das französische Skigebiet Céüze seinen Betrieb auf. Doch an Skifahren ist in dem Ort schon lange nicht mehr zu denken. Es fehlt schlicht der Schnee. Am Dienstag macht das … [+1966 chars],,de,'Schnee Klimawandel'
https://www.welt.de/sport/article6908ade30580923d09985d5c/drama-im-himalaya-zwei-bergsteiger-nach-heftigem-schneefall-in-nepal-vermisst.html,https://www.welt.de/sport/article6908ade30580923d09985d5c/drama-im-himalaya-zwei-bergsteiger-nach-heftigem-schneefall-in-nepal-vermisst.html,0,www.welt.de,Nach Zyklon und heftigem Schneefall – Zwei Bergsteiger in Nepal vermisst,Zwei Bergsteiger aus Italien wollen den 6887 Meter hohen Panbari im Himalaya besteigen. Dann fängt es in Nepal heftig an zu schneien. Seit Tagen besteht kein Kontakt zu den Männern mehr. Ein Hubschrauber rettet nur den Leiter der Expedition.,https://images.welt.de/6908ade30580923d09985d5c/e388e11125bfe2cd6c75589f4bf79b28-master/ci16x9-w1200/afp-79f66cq-jpg,2025-11-03T13:55:49Z,,Zwei Bergsteiger aus Italien wollen den 6887 Meter hohen Panbari im Himalaya besteigen. Dann fängt es in Nepal heftig an zu schneien. Seit Tagen besteht kein Kontakt zu den Männern mehr. Ein Hubschra… [+1584 chars],,de,'Schneefall'
https://www.pcgames.de/Frostpunk-2-Spiel-73439/News/Fractured-Utopias-DLC-Winter-Release-Termin-1485668/,https://www.pcgames.de/Frostpunk-2-Spiel-73439/News/Fractured-Utopias-DLC-Winter-Release-Termin-1485668/,0,www.pcgames.de,Frostpunk 2: Erster DLC Fractured Utopias erscheint im Dezember,"Der erste DLC zu Frostpunk 2 namens Fractured Utopias erscheint am 8. Dezember - passend zur eisigen Jahreszeit. Es wartet ein neuer Utopia-Modus mit fraktionsspezifischen Systemen, Gesetzen und Ereignissen, doch der Umfang sorgt für Diskussionen.",https://www.pcgames.de/screenshots/original/2025/11/Frostpunk-2-Gefeierter-Aufbau-Hit-erhaelt-ersten-DLC-Fractured-Utopias-passend-zur-Jahreszeit-10--pcgh_artwork.jpg,2025-11-03T14:28:00Z,,Der Winter steht vor der Tür und mit ihm kommt die erste DLC-Erweiterung für Frostpunk 2. Denn Entwickler 11 Bit Studios hat das Veröffentlichungsdatum für den DLC Fractured Utopiasbekannt gegeben: A… [+2528 chars],,de,'Frost'
https://www.morgenpost.de/panorama/article410370747/kein-schnee-mehr-wegen-klimawandel-skigebiet-in-frankreich-macht-dicht.html,https://www.morgenpost.de/panorama/article410370747/kein-schnee-mehr-wegen-klimawandel-skigebiet-in-frankreich-macht-dicht.html,0,www.morgenpost.de,Kein Schnee mehr wegen Klimawandel: Skigebiet in Frankreich macht dicht,Schneemangel zwingt ein Skigebiet in den Alpen zu radikalen Maßnahmen: Am Dienstag beginnt der Abbau der Skilifte. Doch es gibt einen Plan B.,https://img.sparknews.funkemedien.de/408331776/408331776_1740047509_v16_9_1600.jpeg,2025-11-03T18:58:33Z,,"Angesichts des Schneemangels, der durch den Klimawandel verstärkt wird, wagen immer mehr Skigebiete in niedrigeren Höhenlagen einen Neuanfang. So beginnt im ehemaligen Skigebiet Céüze in den französi… [+1921 chars]",,de,'Schnee Klimawandel'
https://www.zeit.de/news/2025-11/04/mildes-herbstwetter-in-berlin-und-brandenburg,https://www.zeit.de/news/2025-11/04/mildes-herbstwetter-in-berlin-und-brandenburg,0,www.zeit.de,Nächtlicher Frost möglich: Mildes Herbstwetter in Berlin und Brandenburg,Hier finden Sie Informationen zu dem Thema „Nächtlicher Frost möglich“. Lesen Sie jetzt „Mildes Herbstwetter in Berlin und Brandenburg“.,https://img.zeit.de/news/2025-11/04/mildes-herbstwetter-in-berlin-und-brandenburg-image-group/wide__1300x731,2025-11-04T05:08:53Z,,"Ruhiges Herbstwetter können die Menschen in Berlin und Brandenburg in den kommenden Tagen genießen. Der Dienstag startet bewölkt, heitert aber im Verlauf zunehmend auf, wie der Deutsche Wetterdienst … [+597 chars]",,de,'Frost'
https://www.nzz.ch/wissenschaft/schweizer-klimaszenarien-2025-temperaturanstieg-und-folgen-ld.1909399,https://www.nzz.ch/wissenschaft/schweizer-klimaszenarien-2025-temperaturanstieg-und-folgen-ld.1909399,0,www.nzz.ch,"Tropennächte, Starkregen, weniger Schnee: Neue Szenarien zeigen, wie stark der Klimawandel die Schweiz verändert","Die Klimaszenarien zeigen in grösserem Detail als zuvor, wie die Erderwärmung das Land beeinflusst. Neben der Hitze dürften vor allem Veränderungen beim Niederschlag für Probleme sorgen.","https://img.nzz.ch/2025/11/04/d064ec31-1a6e-4522-8b71-d27e6db5665d.png?width=1200&height=675&fit=bounds&quality=75&auto=webp&crop=1201,676,x0,y113&wmark=nzz",2025-11-04T10:00:00Z,,Selbst im November laden in diesen Tagen Temperaturen bis 15 Grad zum Flanieren ein. Auch dem Laien schwant: Solche Wetterbedingungen sind dank dem Klimawandel wahrscheinlicher geworden. Wie sich das… [+5891 chars],,de,'Schnee Klimawandel'
https://www.zeit.de/news/2025-11/04/soko-frost-greift-zu-razzia-nach-schuessen-in-ludwigsburg,https://www.zeit.de/news/2025-11/04/soko-frost-greift-zu-razzia-nach-schuessen-in-ludwigsburg,0,www.zeit.de,"Kriminalität: Soko ""Frost"" greift zu: Razzia nach Schüssen in Ludwigsburg","Hier finden Sie Informationen zu dem Thema „Kriminalität“. Lesen Sie jetzt „Soko ""Frost"" greift zu: Razzia nach Schüssen in Ludwigsburg“.",https://img.zeit.de/news/2025-11/04/soko-frost-greift-zu-razzia-nach-schuessen-in-ludwigsburg-image-group/wide__1300x731,2025-11-04T16:00:16Z,,Nach einem Fahrzeugbrand in Bietigheim-Bissingen und Schüssen in Ludwigsburg hat die Polizei bei einer großangelegten Razzia mehrere junge Männer festgenommen. Am frühen Morgen wurden die Wohnungen v… [+1585 chars],,de,'Frost'
https://www.zeit.de/news/2025-11/05/mildes-herbstwetter-bringt-sonne-und-frost-nach-nrw,https://www.zeit.de/news/2025-11/05/mildes-herbstwetter-bringt-sonne-und-frost-nach-nrw,0,www.zeit.de,Wetter: Mildes Herbstwetter bringt Sonne und Frost nach NRW,Hier finden Sie Informationen zu dem Thema „Wetter“. Lesen Sie jetzt „Mildes Herbstwetter bringt Sonne und Frost nach NRW“.,https://img.zeit.de/news/2025-11/05/mildes-herbstwetter-bringt-sonne-und-frost-nach-nrw-image-group/wide__1300x731,2025-11-05T05:35:34Z,,"Das Herbstwetter zeigt sich in Nordrhein-Westfalen zur Wochenmitte von seiner ruhigen und milden Seite. Am Mittwoch werden Temperaturen zwischen 15 und 20 Grad erwartet, wie der Deutsche Wetterdienst… [+761 chars]",,de,'Frost'
https://www.zeit.de/news/2025-11/05/hessen-erwartet-sonnige-tage-und-frostige-naechte,https://www.zeit.de/news/2025-11/05/hessen-erwartet-sonnige-tage-und-frostige-naechte,0,www.zeit.de,Wetter: Hessen erwartet sonnige Tage und frostige Nächte,Hier finden Sie Informationen zu dem Thema „Wetter“. Lesen Sie jetzt „Hessen erwartet sonnige Tage und frostige Nächte“.,https://img.zeit.de/news/2025-11/05/hessen-erwartet-sonnige-tage-und-frostige-naechte-image-group/wide__1300x731,2025-11-05T06:10:25Z,,"Sonnige Tage und klirrend kalte Nächte: Hessen erwartet in den kommenden Tagen goldenes Herbstwetter. Am Mittwoch werden Temperaturen zwischen 13 und 17 Grad erwartet, wie der Deutsche Wetterdienst (… [+975 chars]",,de,'Frost'
https://www.stern.de/gesellschaft/regional/berlin-brandenburg/wetter--nebel-und-sonnenschein-in-berlin-und-brandenburg-36197912.html,https://www.stern.de/gesellschaft/regional/berlin-brandenburg/wetter--nebel-und-sonnenschein-in-berlin-und-brandenburg-36197912.html,0,www.stern.de,Wetter: Nebel und Sonnenschein in Berlin und Brandenburg,"Berlin und Brandenburg erwarten zum Wochenende Nebel und Frost, aber auch Sonne. Am nebligen Samstag sind Sichtweiten unter 150 Metern möglich - so die Vorhersage des Deutschen Wetterdienstes.",https://image.stern.de/36197914/t/5y/v1/w1440/r1.7778/-/07--q57ufmu4niv29axs2048jpeg---a8a8c77d8b869a94.jpg,2025-11-07T05:23:32Z,,"Kopiere den aktuellen Link
Zur Merkliste hinzufügen
Berlin und Brandenburg erwarten zum Wochenende Nebel und Frost, aber auch Sonne. Am nebligen Samstag sind Sichtweiten unter 150 Metern möglich - … [+993 chars]",,de,'Frost'
https://www.tagesspiegel.de/berlin/wetter-nebel-und-sonnenschein-in-berlin-und-brandenburg-14778203.html,https://www.tagesspiegel.de/berlin/wetter-nebel-und-sonnenschein-in-berlin-und-brandenburg-14778203.html,0,www.tagesspiegel.de,Wetter: Nebel und Sonnenschein in Berlin und Brandenburg,"Berlin und Brandenburg erwarten zum Wochenende Nebel und Frost, aber auch Sonne. Am nebligen Samstag sind Sichtweiten unter 150 Metern möglich - so die Vorhersage des Deutschen Wetterdienstes.",https://www.tagesspiegel.de/images/14778200/alternates/BASE_16_9_W1400/1762493084000/auto-fahrt-bei-nebel-auf-einer-landstra-e.jpeg,2025-11-07T05:24:44Z,,"Das Wochenende in Berlin und Brandenburg bringt Nebel und Sonnenschein. Wie der Deutsche Wetterdienst (DWD) mitteilte, ist es Freitagfrüh vereinzelt neblig und es kommt örtlich zu Frost. Die Vorhersa… [+839 chars]",,de,'Frost'
https://www.stern.de/gesellschaft/regional/thueringen/wetter--truebes-herbstwochenende-in-thueringen-36198066.html,https://www.stern.de/gesellschaft/regional/thueringen/wetter--truebes-herbstwochenende-in-thueringen-36198066.html,0,www.stern.de,Wetter: Trübes Herbstwochenende in Thüringen,Nach einem sonnigen Start wird das Wochenende in Thüringen zunehmend grau und neblig. Der Deutsche Wetterdienst rechnet in den Nächten auch mit leichtem Frost.,https://image.stern.de/36198068/t/hG/v1/w1440/r1.7778/-/07--hqrdjj67jmv4axs2048jpeg---433371411ecef142.jpg,2025-11-07T06:47:58Z,,"Kopiere den aktuellen Link
Zur Merkliste hinzufügen
Nach einem sonnigen Start wird das Wochenende in Thüringen zunehmend grau und neblig. Der Deutsche Wetterdienst rechnet in den Nächten auch mit l… [+1177 chars]",,de,'Frost'
https://www.stern.de/gesellschaft/regional/hessen/verkehr--hessen-mobil-informiert-ueber-winterdienst-saison-36290694.html,https://www.stern.de/gesellschaft/regional/hessen/verkehr--hessen-mobil-informiert-ueber-winterdienst-saison-36290694.html,0,www.stern.de,Verkehr: Hessen Mobil informiert über Winterdienst-Saison,"Mit Beginn der Winterdienstsaison sind rund 1.000 Beschäftigte im Einsatz, um Hessens Straßen von Eis und Schnee zu befreien. Wie sie dabei vorgehen, erklärt Hessen Mobil.",https://image.stern.de/36290696/t/iT/v1/w1440/r1.7778/-/10--htvcgqupocv1axs2048jpeg---6be772125f73c9e2.jpg,2025-11-10T02:30:10Z,,"Kopiere den aktuellen Link
Zur Merkliste hinzufügen
Mit Beginn der Winterdienstsaison sind rund 1.000 Beschäftigte im Einsatz, um Hessens Straßen von Eis und Schnee zu befreien. Wie sie dabei vorge… [+786 chars]",,de,'Schnee Verkehr'
