index,url,valid,domain,title,description,image,published,archive,content,quote,language,keyword
https://www.kino-zeit.de/film-kritiken-trailer/melt-2025,https://www.kino-zeit.de/film-kritiken-trailer/melt-2025,0,www.kino-zeit.de,Melt (2025),"Film

 

 
 




 
 Nikolaus Geyrhalter Filmproduktion GmbH

 
 Melt (2025) von Nikolaus Geyrhalter

 
 






In opulenten Bildern von Eis und Schnee aus den Alpen über Kanada und Japan bis in die Antarktis feiert der Film eine vergängliche Schönheit. Die…",https://www.kino-zeit.de/sites/default/files/styles/grosse_klickstrecke_940x530_/public/2025-11/melt_2025_1.jpg?itok=edYBxY7U,2025-11-01T10:31:45Z,,"Nicht verpassen:
Filmwecker stelleniDer Kino-Zeit-Filmwecker schickt Dir eine E-Mail, wenn Melt (2025) in einem Kino in Deiner Nähe läuft oder für das Heimkino (Streaming / DVD / Blu-ray) am Start i… [+2 chars]",,de,'Schnee Eis'
https://www.tagesspiegel.de/gesellschaft/reise/wer-will-schon-im-schnee-urlaub-machen-zum-beispiel-dieser-franzosische-fotograf-14582738.html,https://www.tagesspiegel.de/gesellschaft/reise/wer-will-schon-im-schnee-urlaub-machen-zum-beispiel-dieser-franzosische-fotograf-14582738.html,0,www.tagesspiegel.de,Wer will schon im Schnee Urlaub machen?: Zum Beispiel dieser französische Fotograf,Sind Winterferien überhaupt Urlaub oder doch nur Überlebenstraining auf technisch hohem Niveau? Die Bilder von Christophe Jacrot helfen bei der Wahrheitsfindung.,https://www.tagesspiegel.de/images/14582705/alternates/BASE_16_9_W1400/1761815336000/p-171-photo-christophe-jacrot-winterland-teneues-2025-helleren-norway.jpeg,2025-11-03T09:33:30Z,,"Es lässt sich nicht leugnen: Der Winter steht vor der Tür. Die Temperaturen sinken, die Berliner Sonne schaltet in ihren Kellermodus. Sechs Monate Grauzeit stehen bevor, unterbrochen vielleicht von e… [+6104 chars]",,de,'Schnee Eis'
https://www.stern.de/familie/den-garten-winterfest-machen--so-schuetzen-sie-pflanzen---moebel-9021214.html,https://www.stern.de/familie/den-garten-winterfest-machen--so-schuetzen-sie-pflanzen---moebel-9021214.html,0,www.stern.de,"Kalte Jahreszeit: Den Garten winterfest machen: So überdauern Ihre Pflanzen Frost, Eis und Schnee","Nicht nur Pflanzen, sondern auch Gartenmöbel leiden im Winter. Wenn Sie im Frühjahr keine bösen Überraschungen erleben wollen, sollten Sie Ihren Garten zeitnah winterfest machen.",https://image.stern.de/9021216/t/I1/v6/w1440/r1.7778/-/garten-winterfest-machen-neu.jpg,2025-11-03T11:29:00Z,,"Kopiere den aktuellen Link
Zur Merkliste hinzufügen
Nicht nur Pflanzen, sondern auch Gartenmöbel leiden im Winter. Wenn Sie im Frühjahr keine bösen Überraschungen erleben wollen, sollten Sie Ihren … [+7664 chars]",,de,'Schnee Eis'
https://www.n-tv.de/panorama/Franzoesisches-Skigebiet-Ceueze-baut-alle-Skilifte-ab-article26137568.html,https://www.n-tv.de/panorama/Franzoesisches-Skigebiet-Ceueze-baut-alle-Skilifte-ab-article26137568.html,0,www.n-tv.de,Klimawandel raubt den Schnee: Französisches Skigebiet Céüze baut alle Skilifte ab,In den 1930er-Jahren nimmt das französische Skigebiet Céüze seinen Betrieb auf. Doch an Skifahren ist in dem Ort schon lange nicht mehr zu denken. Es fehlt schlicht der Schnee. Am Dienstag macht das Skigebiet daher Nägel mit Köpfen und stellt sich neu auf.,https://www.n-tv.de/img/incoming/crop26137596/0881322235-cImg_16_9-w1200/469540363.jpg,2025-11-03T12:43:28Z,,In den 1930er-Jahren nimmt das französische Skigebiet Céüze seinen Betrieb auf. Doch an Skifahren ist in dem Ort schon lange nicht mehr zu denken. Es fehlt schlicht der Schnee. Am Dienstag macht das … [+1966 chars],,de,'Schnee Klimawandel'
https://www.welt.de/sport/article6908ade30580923d09985d5c/drama-im-himalaya-zwei-bergsteiger-nach-heftigem-schneefall-in-nepal-vermisst.html,https://www.welt.de/sport/article6908ade30580923d09985d5c/drama-im-himalaya-zwei-bergsteiger-nach-heftigem-schneefall-in-nepal-vermisst.html,0,www.welt.de,Nach Zyklon und heftigem Schneefall – Zwei Bergsteiger in Nepal vermisst,Zwei Bergsteiger aus Italien wollen den 6887 Meter hohen Panbari im Himalaya besteigen. Dann fängt es in Nepal heftig an zu schneien. Seit Tagen besteht kein Kontakt zu den Männern mehr. Ein Hubschrauber rettet nur den Leiter der Expedition.,https://images.welt.de/6908ade30580923d09985d5c/e388e11125bfe2cd6c75589f4bf79b28-master/ci16x9-w1200/afp-79f66cq-jpg,2025-11-03T13:55:49Z,,Zwei Bergsteiger aus Italien wollen den 6887 Meter hohen Panbari im Himalaya besteigen. Dann fängt es in Nepal heftig an zu schneien. Seit Tagen besteht kein Kontakt zu den Männern mehr. Ein Hubschra… [+1584 chars],,de,'Schneefall'
https://www.pcgames.de/Frostpunk-2-Spiel-73439/News/Fractured-Utopias-DLC-Winter-Release-Termin-1485668/,https://www.pcgames.de/Frostpunk-2-Spiel-73439/News/Fractured-Utopias-DLC-Winter-Release-Termin-1485668/,0,www.pcgames.de,Frostpunk 2: Erster DLC Fractured Utopias erscheint im Dezember,"Der erste DLC zu Frostpunk 2 namens Fractured Utopias erscheint am 8. Dezember - passend zur eisigen Jahreszeit. Es wartet ein neuer Utopia-Modus mit fraktionsspezifischen Systemen, Gesetzen und Ereignissen, doch der Umfang sorgt für Diskussionen.",https://www.pcgames.de/screenshots/original/2025/11/Frostpunk-2-Gefeierter-Aufbau-Hit-erhaelt-ersten-DLC-Fractured-Utopias-passend-zur-Jahreszeit-10--pcgh_artwork.jpg,2025-11-03T14:28:00Z,,Der Winter steht vor der Tür und mit ihm kommt die erste DLC-Erweiterung für Frostpunk 2. Denn Entwickler 11 Bit Studios hat das Veröffentlichungsdatum für den DLC Fractured Utopiasbekannt gegeben: A… [+2528 chars],,de,'Frost'
https://www.morgenpost.de/panorama/article410370747/kein-schnee-mehr-wegen-klimawandel-skigebiet-in-frankreich-macht-dicht.html,https://www.morgenpost.de/panorama/article410370747/kein-schnee-mehr-wegen-klimawandel-skigebiet-in-frankreich-macht-dicht.html,0,www.morgenpost.de,Kein Schnee mehr wegen Klimawandel: Skigebiet in Frankreich macht dicht,Schneemangel zwingt ein Skigebiet in den Alpen zu radikalen Maßnahmen: Am Dienstag beginnt der Abbau der Skilifte. Doch es gibt einen Plan B.,https://img.sparknews.funkemedien.de/408331776/408331776_1740047509_v16_9_1600.jpeg,2025-11-03T18:58:33Z,,"Angesichts des Schneemangels, der durch den Klimawandel verstärkt wird, wagen immer mehr Skigebiete in niedrigeren Höhenlagen einen Neuanfang. So beginnt im ehemaligen Skigebiet Céüze in den französi… [+1921 chars]",,de,'Schnee Klimawandel'
https://www.stern.de/gesellschaft/regional/berlin-brandenburg/naechtlicher-frost-moeglich--mildes-herbstwetter-in-berlin-und-brandenburg-36186178.html,https://www.stern.de/gesellschaft/regional/berlin-brandenburg/naechtlicher-frost-moeglich--mildes-herbstwetter-in-berlin-und-brandenburg-36186178.html,0,www.stern.de,Nächtlicher Frost möglich: Mildes Herbstwetter in Berlin und Brandenburg,"Potsdam/Berlin - Ruhiges Herbstwetter können die Menschen in Berlin und Brandenburg in den kommenden Tagen genießen. Der Dienstag startet bewölkt,",https://image.stern.de/36186180/t/Cp/v1/w1440/r1.7778/-/04--eil35oltndv10axs2048jpeg---f8e5b66a20946e1b.jpg,2025-11-04T05:08:53Z,,"Kopiere den aktuellen Link
Zur Merkliste hinzufügen
Sonne, Wolken und milde Temperaturen: Die kommenden Tage bringen angenehmes Herbstwetter nach Berlin und Brandenburg. Nachts kann es Frost geben.… [+758 chars]",,de,'Frost'
https://www.zeit.de/news/2025-11/04/mildes-herbstwetter-in-berlin-und-brandenburg,https://www.zeit.de/news/2025-11/04/mildes-herbstwetter-in-berlin-und-brandenburg,0,www.zeit.de,Nächtlicher Frost möglich: Mildes Herbstwetter in Berlin und Brandenburg,Hier finden Sie Informationen zu dem Thema „Nächtlicher Frost möglich“. Lesen Sie jetzt „Mildes Herbstwetter in Berlin und Brandenburg“.,https://img.zeit.de/news/2025-11/04/mildes-herbstwetter-in-berlin-und-brandenburg-image-group/wide__1300x731,2025-11-04T05:08:53Z,,"Ruhiges Herbstwetter können die Menschen in Berlin und Brandenburg in den kommenden Tagen genießen. Der Dienstag startet bewölkt, heitert aber im Verlauf zunehmend auf, wie der Deutsche Wetterdienst … [+597 chars]",,de,'Frost'
https://www.nzz.ch/wissenschaft/schweizer-klimaszenarien-2025-temperaturanstieg-und-folgen-ld.1909399,https://www.nzz.ch/wissenschaft/schweizer-klimaszenarien-2025-temperaturanstieg-und-folgen-ld.1909399,0,www.nzz.ch,"Tropennächte, Starkregen, weniger Schnee: Neue Szenarien zeigen, wie stark der Klimawandel die Schweiz verändert","Die Klimaszenarien zeigen in grösserem Detail als zuvor, wie die Erderwärmung das Land beeinflusst. Neben der Hitze dürften vor allem Veränderungen beim Niederschlag für Probleme sorgen.","https://img.nzz.ch/2025/11/04/d064ec31-1a6e-4522-8b71-d27e6db5665d.png?width=1200&height=675&fit=bounds&quality=75&auto=webp&crop=1201,676,x0,y113&wmark=nzz",2025-11-04T10:00:00Z,,Selbst im November laden in diesen Tagen Temperaturen bis 15 Grad zum Flanieren ein. Auch dem Laien schwant: Solche Wetterbedingungen sind dank dem Klimawandel wahrscheinlicher geworden. Wie sich das… [+5891 chars],,de,'Schnee Klimawandel'
https://www.welt.de/wissenschaft/plus690328991118a64696446d9e/wein-in-gefahr-frueher-war-die-reihenfolge-klar-heute-reift-alles-durcheinander.html,https://www.welt.de/wissenschaft/plus690328991118a64696446d9e/wein-in-gefahr-frueher-war-die-reihenfolge-klar-heute-reift-alles-durcheinander.html,0,www.welt.de,„Früher war die Reihenfolge klar. Heute reift alles durcheinander“,"Weltweit kämpfen Weinbauern zunehmend mit Trockenheit, Hitze und Frost. Damit der Wein in Deutschland auch in Zukunft schmeckt, arbeiten Forscher an einer neuen Herstellungsmethode. Vorbild können Winzer in Chile sein. Besuch auf einem Weingut.",https://images.welt.de/690328991118a64696446d9e/dfed45e45a9143506c37fd3bb41cfa1b/ci16x9-w1200/gettyimages-526617701-jpg,2025-11-04T14:37:53Z,,"Weltweit kämpfen Weinbauern zunehmend mit Trockenheit, Hitze und Frost. Damit der Wein in Deutschland auch in Zukunft schmeckt, arbeiten Forscher an einer neuen Herstellungsmethode. Vorbild können Wi… [+44 chars]",,de,'Frost'
https://www.zeit.de/news/2025-11/04/soko-frost-greift-zu-razzia-nach-schuessen-in-ludwigsburg,https://www.zeit.de/news/2025-11/04/soko-frost-greift-zu-razzia-nach-schuessen-in-ludwigsburg,0,www.zeit.de,"Kriminalität: Soko ""Frost"" greift zu: Razzia nach Schüssen in Ludwigsburg","Hier finden Sie Informationen zu dem Thema „Kriminalität“. Lesen Sie jetzt „Soko ""Frost"" greift zu: Razzia nach Schüssen in Ludwigsburg“.",https://img.zeit.de/news/2025-11/04/soko-frost-greift-zu-razzia-nach-schuessen-in-ludwigsburg-image-group/wide__1300x731,2025-11-04T16:00:16Z,,Nach einem Fahrzeugbrand in Bietigheim-Bissingen und Schüssen in Ludwigsburg hat die Polizei bei einer großangelegten Razzia mehrere junge Männer festgenommen. Am frühen Morgen wurden die Wohnungen v… [+1585 chars],,de,'Frost'
https://www.stern.de/gesellschaft/regional/nordrhein-westfalen/wetter--mildes-herbstwetter-bringt-sonne-und-frost-nach-nrw-36189808.html,https://www.stern.de/gesellschaft/regional/nordrhein-westfalen/wetter--mildes-herbstwetter-bringt-sonne-und-frost-nach-nrw-36189808.html,0,www.stern.de,Wetter: Mildes Herbstwetter bringt Sonne und Frost nach NRW,"Sonnige Tage, frostige Nächte: Das Herbstwetter in NRW bringt milde Temperaturen und vereinzelt Bodenfrost. Was der Deutsche Wetterdienst für die nächsten Tage vorhersagt.",https://image.stern.de/36189810/t/Ch/v1/w1440/r1.7778/-/05--k5lyxekfa2v5axs2048jpeg---672d1146320b35de.jpg,2025-11-05T05:35:34Z,,"Kopiere den aktuellen Link
Zur Merkliste hinzufügen
Sonnige Tage, frostige Nächte: Das Herbstwetter in NRW bringt milde Temperaturen und vereinzelt Bodenfrost. Was der Deutsche Wetterdienst für die… [+948 chars]",,de,'Frost'
https://www.zeit.de/news/2025-11/05/mildes-herbstwetter-bringt-sonne-und-frost-nach-nrw,https://www.zeit.de/news/2025-11/05/mildes-herbstwetter-bringt-sonne-und-frost-nach-nrw,0,www.zeit.de,Wetter: Mildes Herbstwetter bringt Sonne und Frost nach NRW,Hier finden Sie Informationen zu dem Thema „Wetter“. Lesen Sie jetzt „Mildes Herbstwetter bringt Sonne und Frost nach NRW“.,https://img.zeit.de/news/2025-11/05/mildes-herbstwetter-bringt-sonne-und-frost-nach-nrw-image-group/wide__1300x731,2025-11-05T05:35:34Z,,"Das Herbstwetter zeigt sich in Nordrhein-Westfalen zur Wochenmitte von seiner ruhigen und milden Seite. Am Mittwoch werden Temperaturen zwischen 15 und 20 Grad erwartet, wie der Deutsche Wetterdienst… [+761 chars]",,de,'Frost'
https://www.zeit.de/news/2025-11/05/hessen-erwartet-sonnige-tage-und-frostige-naechte,https://www.zeit.de/news/2025-11/05/hessen-erwartet-sonnige-tage-und-frostige-naechte,0,www.zeit.de,Wetter: Hessen erwartet sonnige Tage und frostige Nächte,Hier finden Sie Informationen zu dem Thema „Wetter“. Lesen Sie jetzt „Hessen erwartet sonnige Tage und frostige Nächte“.,https://img.zeit.de/news/2025-11/05/hessen-erwartet-sonnige-tage-und-frostige-naechte-image-group/wide__1300x731,2025-11-05T06:10:25Z,,"Sonnige Tage und klirrend kalte Nächte: Hessen erwartet in den kommenden Tagen goldenes Herbstwetter. Am Mittwoch werden Temperaturen zwischen 13 und 17 Grad erwartet, wie der Deutsche Wetterdienst (… [+975 chars]",,de,'Frost'
https://www.stern.de/gesellschaft/regional/hessen/wetter--hessen-erwartet-sonnige-tage-und-frostige-naechte-36189850.html,https://www.stern.de/gesellschaft/regional/hessen/wetter--hessen-erwartet-sonnige-tage-und-frostige-naechte-36189850.html,0,www.stern.de,Wetter: Hessen erwartet sonnige Tage und frostige Nächte,"Tagsüber Sonne, nachts Frost: In Hessen zeigt sich der Herbst von seiner goldenen, aber auch kalten Seite. Was der Deutsche Wetterdienst für die kommenden Tage vorhersagt.",https://image.stern.de/36189852/t/ri/v1/w1440/r1.7778/-/05--t2ymds6fctv6axs2048jpeg---af40549ad2da9cbb.jpg,2025-11-05T06:10:25Z,,"Kopiere den aktuellen Link
Zur Merkliste hinzufügen
Tagsüber Sonne, nachts Frost: In Hessen zeigt sich der Herbst von seiner goldenen, aber auch kalten Seite. Was der Deutsche Wetterdienst für die … [+1162 chars]",,de,'Frost'
https://www.stern.de/gesellschaft/regional/berlin-brandenburg/wetter--nebel-und-sonnenschein-in-berlin-und-brandenburg-36197912.html,https://www.stern.de/gesellschaft/regional/berlin-brandenburg/wetter--nebel-und-sonnenschein-in-berlin-und-brandenburg-36197912.html,0,www.stern.de,Wetter: Nebel und Sonnenschein in Berlin und Brandenburg,"Berlin und Brandenburg erwarten zum Wochenende Nebel und Frost, aber auch Sonne. Am nebligen Samstag sind Sichtweiten unter 150 Metern möglich - so die Vorhersage des Deutschen Wetterdienstes.",https://image.stern.de/36197914/t/5y/v1/w1440/r1.7778/-/07--q57ufmu4niv29axs2048jpeg---a8a8c77d8b869a94.jpg,2025-11-07T05:23:32Z,,"Kopiere den aktuellen Link
Zur Merkliste hinzufügen
Berlin und Brandenburg erwarten zum Wochenende Nebel und Frost, aber auch Sonne. Am nebligen Samstag sind Sichtweiten unter 150 Metern möglich - … [+993 chars]",,de,'Frost'
https://www.tagesspiegel.de/berlin/wetter-nebel-und-sonnenschein-in-berlin-und-brandenburg-14778203.html,https://www.tagesspiegel.de/berlin/wetter-nebel-und-sonnenschein-in-berlin-und-brandenburg-14778203.html,0,www.tagesspiegel.de,Wetter: Nebel und Sonnenschein in Berlin und Brandenburg,"Berlin und Brandenburg erwarten zum Wochenende Nebel und Frost, aber auch Sonne. Am nebligen Samstag sind Sichtweiten unter 150 Metern möglich - so die Vorhersage des Deutschen Wetterdienstes.",https://www.tagesspiegel.de/images/14778200/alternates/BASE_16_9_W1400/1762493084000/auto-fahrt-bei-nebel-auf-einer-landstra-e.jpeg,2025-11-07T05:24:44Z,,"Das Wochenende in Berlin und Brandenburg bringt Nebel und Sonnenschein. Wie der Deutsche Wetterdienst (DWD) mitteilte, ist es Freitagfrüh vereinzelt neblig und es kommt örtlich zu Frost. Die Vorhersa… [+839 chars]",,de,'Frost'
https://www.stern.de/gesellschaft/regional/thueringen/wetter--truebes-herbstwochenende-in-thueringen-36198066.html,https://www.stern.de/gesellschaft/regional/thueringen/wetter--truebes-herbstwochenende-in-thueringen-36198066.html,0,www.stern.de,Wetter: Trübes Herbstwochenende in Thüringen,Nach einem sonnigen Start wird das Wochenende in Thüringen zunehmend grau und neblig. Der Deutsche Wetterdienst rechnet in den Nächten auch mit leichtem Frost.,https://image.stern.de/36198068/t/hG/v1/w1440/r1.7778/-/07--hqrdjj67jmv4axs2048jpeg---433371411ecef142.jpg,2025-11-07T06:47:58Z,,"Kopiere den aktuellen Link
Zur Merkliste hinzufügen
Nach einem sonnigen Start wird das Wochenende in Thüringen zunehmend grau und neblig. Der Deutsche Wetterdienst rechnet in den Nächten auch mit l… [+1177 chars]",,de,'Frost'
https://www.stern.de/gesellschaft/regional/hessen/verkehr--hessen-mobil-informiert-ueber-winterdienst-saison-36290694.html,https://www.stern.de/gesellschaft/regional/hessen/verkehr--hessen-mobil-informiert-ueber-winterdienst-saison-36290694.html,0,www.stern.de,Verkehr: Hessen Mobil informiert über Winterdienst-Saison,"Mit Beginn der Winterdienstsaison sind rund 1.000 Beschäftigte im Einsatz, um Hessens Straßen von Eis und Schnee zu befreien. Wie sie dabei vorgehen, erklärt Hessen Mobil.",https://image.stern.de/36290696/t/iT/v1/w1440/r1.7778/-/10--htvcgqupocv1axs2048jpeg---6be772125f73c9e2.jpg,2025-11-10T02:30:10Z,,"Kopiere den aktuellen Link
Zur Merkliste hinzufügen
Mit Beginn der Winterdienstsaison sind rund 1.000 Beschäftigte im Einsatz, um Hessens Straßen von Eis und Schnee zu befreien. Wie sie dabei vorge… [+786 chars]",,de,'Schnee Verkehr'
https://www.sueddeutsche.de/bayern/bayern-wetter-sonne-frost-temperaturen-november-li.3336907,https://www.sueddeutsche.de/bayern/bayern-wetter-sonne-frost-temperaturen-november-li.3336907,0,www.sueddeutsche.de,Ungewöhnliche Wettervorhersage: Sonne und Temperaturen bis zu 20 Grad in Bayern,Sonnenschein statt erster Schnee: Die Meteorologen erwarten in den kommenden Tagen ungewöhnlich milde Temperaturen im Freistaat. Trotzdem kann es mancherorts auch eisig werden.,https://www.sueddeutsche.de/2025/11/10/412865af-dc43-4985-8beb-7b59162b9890.jpg?q=60&fm=webp&width=1200&rect=0%2C870%2C4000%2C2250,2025-11-10T12:53:51Z,,Im Laufe des Dienstags dreht demnach der Wind und warme Luft zieht vom Mittelmeer nach Bayern. In den darauffolgenden Tagen kommt dann immer mehr warme Luft in den Freistaat und es wird spürbar wärme… [+1146 chars],,de,'Glätte'
https://www.stern.de/gesellschaft/regional/hessen/verkehr--feuchtsalz-und-fruehschicht--wie-sich-der-winterdienst-ruestet-36308410.html,https://www.stern.de/gesellschaft/regional/hessen/verkehr--feuchtsalz-und-fruehschicht--wie-sich-der-winterdienst-ruestet-36308410.html,0,www.stern.de,Verkehr: Feuchtsalz und Frühschicht: Wie sich der Winterdienst rüstet,"Schnee und Eis können kommen. Rund 1.000 Mitarbeitende und 390 Streu- und Räumfahrzeuge stehen für die Bundes-, Landes- und Kreisstraßen in Hessen bereit.",https://image.stern.de/36308412/t/wt/v1/w1440/r1.7778/-/10--c2c5dusl4lv13axs2048jpeg---fb3eede7fcea3b89.jpg,2025-11-10T14:33:36Z,,"Kopiere den aktuellen Link
Zur Merkliste hinzufügen
Schnee und Eis können kommen. Rund 1.000 Mitarbeitende und 390 Streu- und Räumfahrzeuge stehen für die Bundes-, Landes- und Kreisstraßen in Hesse… [+5921 chars]",,de,'Schnee Verkehr'
https://www.tagesspiegel.de/berlin/13000-tonnen-salz-gebunkert-bsr-rustet-sich-fur-den-winterdienst-auf-berlins-strassen-14802557.html,https://www.tagesspiegel.de/berlin/13000-tonnen-salz-gebunkert-bsr-rustet-sich-fur-den-winterdienst-auf-berlins-strassen-14802557.html,0,www.tagesspiegel.de,13.000 Tonnen Salz gebunkert: BSR rüstet sich für den Winterdienst auf Berlins Straßen,"Die Lager der Berliner Stadtreinigung sind mit Streugut gefüllt, rund 2300 Beschäftigte stehen bereit: Schnee und Eis können in der Hauptstadt kommen. Doch nicht für alles ist die BSR zuständig.",https://www.tagesspiegel.de/images/14802554/alternates/BASE_16_9_W1400/1762793760000/winterwetter-in-berlin.jpeg,2025-11-10T15:56:00Z,,Mit Tausenden Tonnen Streugut will die Berliner Stadtreinigung (BSR) in diesem Winter die Fahrbahnen der Hauptstadt von glatten Straßen befreien. In den Streugutlagern befinden sich Vorräte von etwa … [+1295 chars],,de,'Schnee Eis'
https://www.waz.de/sport/article410426538/schneeschaufel-und-spektakulaerer-fallrueckzieher-historisches-fussball-finale-in-kanada.html,https://www.waz.de/sport/article410426538/schneeschaufel-und-spektakulaerer-fallrueckzieher-historisches-fussball-finale-in-kanada.html,0,www.waz.de,Schneechaos und spektakulärer Fallrückzieher: Historisches Finale in Kanada,"Ein Schneesturm, eisige Temperaturen und ein dramatisches Finale: In Kanada wurde Fußballgeschichte unter außergewöhnlichen Bedingungen geschrieben.",https://img.sparknews.funkemedien.de/410426539/410426539_1762822762_v16_9_1600.jpeg,2025-11-11T01:12:10Z,,Atletico Ottawa hat sich am Sonntag in einem packenden Finale der Canadian Premier League gegen Cavalry FC mit 2:1 nach Verlängerung durchgesetzt und dabei ein Stück Fußballgeschichte geschrieben. Da… [+1775 chars],,de,'Schneefall'
https://www.n-tv.de/panorama/Odin-und-Pepe-bringen-Saharaluft-und-bis-zu-20-Grad-id30006949.html,https://www.n-tv.de/panorama/Odin-und-Pepe-bringen-Saharaluft-und-bis-zu-20-Grad-id30006949.html,0,www.n-tv.de,"Direkt danach droht Schnee: ""Odin"" und ""Pepe"" bringen Saharaluft und bis zu 20 Grad",Der November bringt den meisten Deutschen noch einmal ein kurzzeitiges Wärme-Intermezzo. Die Thermometer könnten mancherorts auf Rekordtemperaturen steigen. Doch im Anschluss droht der Frost-Einbruch.,https://www.n-tv.de/img/30006929/1762861923/Img_16_9/1200/In-Bayern-versprechen-die-Prognosen-viele-Sonnenstunden.jpg,2025-11-11T12:07:56Z,,"In Bayern versprechen die Prognosen viele Sonnenstunden. (Foto: picture alliance / Fotostand)
Der November bringt den meisten Deutschen noch einmal ein kurzzeitiges Wärme-Intermezzo. Die Thermometer… [+4432 chars]",,de,'Eis Frost'
https://www.bild.de/news/ausland/wegen-schneemangels-alpen-gemeinde-baut-skilifte-ab-6911bca00580923d0998cd49,https://www.bild.de/news/ausland/wegen-schneemangels-alpen-gemeinde-baut-skilifte-ab-6911bca00580923d0998cd49,0,www.bild.de,Wegen Schneemangels - Alpen-Gemeinde baut Skilifte ab,Ein Skigebiet in den Alpen gibt auf und baut seine Lifte ab. Seit Jahren fehlt es an Schnee.,"https://images.bild.de/6911bca00580923d0998cd49/3e8da488fcc9f38ca2bacf451c7ad690,d0c91fa6?w=1280",2025-11-11T13:52:51Z,,Buëch-Dévoluy (Frankreich) Der Klimawandel schlägt jetzt auch den französischen Alpen gnadenlos ins Gesicht: Wegen Schneemangels gibt nun das Skigebiet Céüze endgültig auf. Ab Dienstag werden die Ski… [+2307 chars],,de,'Schnee Ski'
https://www.bild.de/news/ausland/skigebiet-in-den-alpen-gibt-auf-und-baut-seine-lifte-ab-6911bca00580923d0998cd49,https://www.bild.de/news/ausland/skigebiet-in-den-alpen-gibt-auf-und-baut-seine-lifte-ab-6911bca00580923d0998cd49,0,www.bild.de,Wegen Schneemangels - Skigebiet in den Alpen baut seine Lifte ab,"Die Alpen-Gemeinde hat damit angefangen, ihre Skilifte abzubauen. Lesen Sie hier, wie es dazu kam.","https://images.bild.de/6911bca00580923d0998cd49/3e8da488fcc9f38ca2bacf451c7ad690,d0c91fa6?w=1280",2025-11-11T16:05:11Z,,Buëch-Dévoluy (Frankreich) Der Klimawandel schlägt jetzt auch den französischen Alpen gnadenlos ins Gesicht: Wegen Schneemangels gibt nun das Skigebiet Céüze endgültig auf. Ab Dienstag werden die Ski… [+2307 chars],,de,'Schnee Klimawandel'
https://www.welt.de/vermischtes/article691416ed71dafa6e0afd0eea/wintereinbruch-ungewohnte-kaelte-in-florida-leguane-fallen-tot-von-den-baeumen.html,https://www.welt.de/vermischtes/article691416ed71dafa6e0afd0eea/wintereinbruch-ungewohnte-kaelte-in-florida-leguane-fallen-tot-von-den-baeumen.html,0,www.welt.de,Ungewohnte Kälte in Florida – Leguane fallen tot von den Bäumen,Rekordkälte an der Ostküste der USA. Der Wintereinbruch mit Frost und Schnee erwischte sogar Florida. Leguane geraten in Schockstarre und fallen von den Bäumen.,https://images.welt.de/691416ed71dafa6e0afd0eea/733f8f2ae4f51997e23109256b3d1d48-master/ci16x9-w1200/558027584-jpg,2025-11-12T05:37:37Z,,Rekordkälte an der Ostküste der USA. Der Wintereinbruch mit Frost und Schnee erwischte sogar Florida. Leguane geraten in Schockstarre und fallen von den Bäumen.Die erste große Kältewelle der Saison s… [+2240 chars],,de,'Schnee Eis'
https://www.stern.de/gesellschaft/regional/bayern/wettervorhersage--sonne-und-bis-zu-20-grad---mit-der-neuen-woche-kuehler-36336518.html,https://www.stern.de/gesellschaft/regional/bayern/wettervorhersage--sonne-und-bis-zu-20-grad---mit-der-neuen-woche-kuehler-36336518.html,0,www.stern.de,Wettervorhersage: Sonne und bis zu 20 Grad - mit der neuen Woche kühler,"München (lby) - Leichter Frost nachts, ungewöhnlich mild tagsüber und vielerorts Sonne: In den nächsten Tagen verwöhnt das Wetter die Bayern noch einmal,",https://image.stern.de/36336520/t/rP/v1/w1440/r1.7778/-/12--tl7s72eawlv3axs2048jpeg---832668fa721d6804.jpg,2025-11-12T05:41:19Z,,"Kopiere den aktuellen Link
Zur Merkliste hinzufügen
Der Deutsche Wetterdienst erwartet für Bayern ungewöhnlich milde Novembertage. Doch mit dem Wochenende wird es feuchter und frischer.
Leichter F… [+1337 chars]",,de,'Frost'
