index,url,valid,domain,title,description,image,published,archive,content,quote,language,keyword
https://www.sueddeutsche.de/bayern/wetter-bayern-sonne-temperatur-schnee-li.3337657,https://www.sueddeutsche.de/bayern/wetter-bayern-sonne-temperatur-schnee-li.3337657,0,www.sueddeutsche.de,Wetter in Bayern: 20 Grad im November - und dann Schneefall,"Meteorologen erwarten für Bayern noch ein paar ungewöhnlich milde Novembertage. Doch mit dem Wochenende wird es feuchter, frischer und ungemütlicher.",https://www.sueddeutsche.de/2025/11/12/4db69f0d-433c-407f-afa5-d3a429a42059.jpg?q=60&fm=webp&width=1200&rect=0%2C155%2C3000%2C1687,2025-11-12T13:48:00Z,,Am Mittwoch gelangt am Rande einer Hochdruckzone zunächst trockene und für die Jahreszeit sehr milde Luft nach Bayern. In Bodennähe kann es zunächst aber feucht-kühl bleiben. Bis zum Vormittag ist st… [+972 chars],,de,'Schneefall'
https://www.n-tv.de/wissen/Schmelzender-Permafrost-loest-Felsstuerze-in-den-Alpen-aus-id30016553.html,https://www.n-tv.de/wissen/Schmelzender-Permafrost-loest-Felsstuerze-in-den-Alpen-aus-id30016553.html,0,www.n-tv.de,Wachsende Gefahr für Bergsteiger: Schmelzender Permafrost löst Felsstürze in den Alpen aus,"Felsstürze in den Alpen häufen sich und können auch tödlich enden. Eine Forschungsgruppe rekonstruiert ein solches Ereignis an der wichtigsten Route zum Matterhorn. Über mehrere Jahre und millimetergenau können sie zeigen, wie der Klimawandel Felsstürze und H…",https://www.n-tv.de/img/30016801/1763029619/Img_16_9/1200/ACHTUNG-Frei-nur-zur-redaktionellen-Verwendung-im-Zusammenhang-mit-der-Berichterstattung-ueber-die-Studie-bei-Nennung-des-Credits-Foto-Samuel-Weber-SLF-HANDOUT-Der-Felspfeiler-am-Matterhorn-vor-dem-Abbruch-Im-Hintergrund-sind-Messgeraete-zu-erkennen.jpg,2025-11-13T10:11:27Z,,"Wachsende Gefahr für BergsteigerSchmelzender Permafrost löst Felsstürze in den Alpen aus
Links: Felsturm während seiner fortschreitenden Kippbewegung bis hin zum Kollaps am 13. Juni 2023. Rechts: Pr… [+3722 chars]",,de,'Schnee Klimawandel'
https://www.stern.de/auto/eiskratzer-fuers-auto--so-haben-sie-im-winter-eine-freie-sicht-36164986.html,https://www.stern.de/auto/eiskratzer-fuers-auto--so-haben-sie-im-winter-eine-freie-sicht-36164986.html,0,www.stern.de,Eiskratzer: Klare Sicht im Winter: So befreien Sie Autoscheiben schnell vom Eis,"Mit dem passenden Eisschaber, intelligenter Technik und entsprechender Vorbereitung besiegen Sie den Frost am Auto. Wir empfehlen die passenden Produkte dazu.",https://image.stern.de/36164988/t/hX/v1/w1440/r1.7778/-/eiskratzer-auto.jpg,2025-11-14T05:53:00Z,,"Kopiere den aktuellen Link
Zur Merkliste hinzufügen
Mit dem passenden Eisschaber, intelligenter Technik und entsprechender Vorbereitung besiegen Sie den Frost am Auto. Wir empfehlen die passenden P… [+7598 chars]",,de,'Frost'
https://www.zeit.de/news/2025-11/14/mit-feuchtem-salz-und-gurkenwasser-gegen-die-glaette,https://www.zeit.de/news/2025-11/14/mit-feuchtem-salz-und-gurkenwasser-gegen-die-glaette,0,www.zeit.de,Winterdienst: Mit feuchtem Salz und Gurkenwasser gegen die Glätte,Hier finden Sie Informationen zu dem Thema „Winterdienst“. Lesen Sie jetzt „Mit feuchtem Salz und Gurkenwasser gegen die Glätte“.,https://img.zeit.de/news/2025-11/14/mit-feuchtem-salz-und-gurkenwasser-gegen-die-glaette-image-group/wide__1300x731,2025-11-14T09:30:53Z,,Mit 400.000 Tonnen Salzvorräten sagt die Bayerische Staatsbauverwaltung dem bevorstehenden Winter auf den bayerischen Landes- und Bundesstraßen den Kampf an. «In dieser Saison sind wir mit insgesamt … [+1859 chars],,de,'Glätte'
https://www.brigitte.de/leben/martha-stewart-verraet---die-beste-zeit-einen-weihnachtsbaum-zu-kaufen--ist----14046224.html,https://www.brigitte.de/leben/martha-stewart-verraet---die-beste-zeit-einen-weihnachtsbaum-zu-kaufen--ist----14046224.html,0,www.brigitte.de,"Martha Stewart verrät: ""Die beste Zeit einen Weihnachtsbaum zu kaufen, ist …""","Lichterglanz, Plätzchenduft und der erste Frost: Die Vorweihnachtszeit beginnt und mit ihr die wichtigste Frage aller Weihnachtsfans. Wann holst du dir am besten deinen Weihnachtsbaum ins Haus?",https://image.brigitte.de/14046228/t/Ei/v1/w1440/r1.7778/-/martha-stewart-verraet-weihnachtsbaum-kaufen.jpg,2025-11-14T19:00:00Z,,"Lichterglanz, Plätzchenduft und der erste Frost: Die Vorweihnachtszeit beginnt und mit ihr die wichtigste Frage aller Weihnachtsfans. Wann holst du dir am besten deinen Weihnachtsbaum ins Haus?
Für … [+743 chars]",,de,'Frost'
https://www.stern.de/gesellschaft/regional/thueringen/skigebiete--wintersportgebiete-in-thueringen--der-schnee-kann-kommen-36550132.html,https://www.stern.de/gesellschaft/regional/thueringen/skigebiete--wintersportgebiete-in-thueringen--der-schnee-kann-kommen-36550132.html,0,www.stern.de,Skigebiete: Wintersportgebiete in Thüringen: Der Schnee kann kommen,"Die Vorbereitungen in den Thüringer Skigebieten sind fast abgeschlossen. Sofern das Wetter mitmacht, fällt Anfang Dezember der Startschuss. Auch Angebote für schneefreie Zeiten werden daher wichtiger.",https://image.stern.de/36550134/t/xO/v1/w1440/r1.7778/-/15--vx3azp7xlqv6axs2048jpeg---339265822fc889de.jpg,2025-11-15T04:00:30Z,,"Kopiere den aktuellen Link
Zur Merkliste hinzufügen
Die Vorbereitungen in den Thüringer Skigebieten sind fast abgeschlossen. Sofern das Wetter mitmacht, fällt Anfang Dezember der Startschuss. Auch … [+4019 chars]",,de,'Schnee Ski'
https://www.morgenpost.de/berlin/article410455564/wetter-berlin-brandenburg-aussichten-prognosen-aktuell-regen-frost-gewitter-schneeregen.html,https://www.morgenpost.de/berlin/article410455564/wetter-berlin-brandenburg-aussichten-prognosen-aktuell-regen-frost-gewitter-schneeregen.html,0,www.morgenpost.de,Wetter-Wirbel in Berlin: Nach Frost drohen Gewitter und Schneeregen,Das Wochenend-Wetter in Berlin und Brandenburg ist dem November-Blues verfallen. Auch zum Wochenstart gibt es ungemütliche Aussichten.,https://img.sparknews.funkemedien.de/410455576/410455576_1763098612_v16_9_1600.jpeg,2025-11-15T08:50:00Z,,"Grau, nass, trüb: Das Wetter in Berlin und Brandenburg ist am Wochenende endgültig im November-Modus angekommen. Der Samstag bleibt den Aussichten des Deutschen Wetterdienstes (DWD) zufolge durchgehe… [+1582 chars]",,de,'Frost'
https://www.stern.de/panorama/wetter--erster-schnee-zu-wochenbeginn-36550892.html,https://www.stern.de/panorama/wetter--erster-schnee-zu-wochenbeginn-36550892.html,0,www.stern.de,Wetter: Erster Schnee zu Wochenbeginn,"Offenbach - Der Winter steht vor der Türe, die ersten weißen Flocken könnten Montagfrüh vom Himmel fallen. Der Deutsche Wetterdienst (DWD) erwartet aber",https://image.stern.de/36550894/t/9h/v1/w1440/r1.7778/-/15--rgdhbeb72cv2axs2048jpeg---1fad5f75ac7b80fc.jpg,2025-11-15T11:03:16Z,,"Kopiere den aktuellen Link
Zur Merkliste hinzufügen
In der Nacht zu Montag könnte es weiß werden. Der Wetterdienst erwartet aber nur ein ""sehr zaghaftes Winterintermezzo"".
Der Winter steht vor der… [+1388 chars]",,de,'Schnee Wetterdienst'
https://www.tagesspiegel.de/gesellschaft/panorama/wetter-erster-schnee-zu-wochenbeginn-14849654.html,https://www.tagesspiegel.de/gesellschaft/panorama/wetter-erster-schnee-zu-wochenbeginn-14849654.html,0,www.tagesspiegel.de,Wetter: Erster Schnee zu Wochenbeginn,In der Nacht zu Montag könnte es weiß werden. Der Wetterdienst erwartet aber nur ein „sehr zaghaftes Winterintermezzo“.,https://www.tagesspiegel.de/images/14849651/alternates/BASE_16_9_W1400/1763204650000/spaziergang-im-regen.jpeg,2025-11-15T11:04:10Z,,"Der Winter steht vor der Türe, die ersten weißen Flocken könnten Montagfrüh vom Himmel fallen. Der Deutsche Wetterdienst (DWD) erwartet aber nur ein sehr zaghaftes Winterintermezzo, wie Meteorologe M… [+1295 chars]",,de,'Schnee Wetterdienst'
https://www.sueddeutsche.de/bayern/bayern-wetter-schnee-eis-glaette-foehn-glatteis-li.3339053,https://www.sueddeutsche.de/bayern/bayern-wetter-schnee-eis-glaette-foehn-glatteis-li.3339053,0,www.sueddeutsche.de,Wetter in Bayern: Kräftiger Schneefall nach föhnigem Wochenende,"In der Nacht zu Montag sinkt die Schneefallgrenze auf 500 bis 700 Meter, in den Alpen rechnen die Meteorologen mit viel Schnee. Auf den Straßen droht Glätte.",https://www.sueddeutsche.de/2025/11/15/0014d7f1-470f-4c88-8efc-40d2a41f1222.jpg?q=60&fm=webp&width=1200&rect=0%2C188%2C4000%2C2250,2025-11-15T14:20:13Z,,"Vorerst sorgen dicke Wolken für graue Herbststimmung, nördlich der Donau fällt etwas Regen. Richtung Alpenrand zeigt sich teils die Sonne. Die Temperaturen reichen von 7 Grad im Passauer Land bis zu … [+1095 chars]",,de,'Glätte'
https://www.zeit.de/wissen/umwelt/2025-11/erster-schnee-deutschland-wetter-deutscher-wetterdienst,https://www.zeit.de/wissen/umwelt/2025-11/erster-schnee-deutschland-wetter-deutscher-wetterdienst,0,www.zeit.de,Deutscher Wetterdienst: Erste Schneeflocken für Montagmorgen erwartet,In den Alpen und in den Hochlagen der Mittelgebirge kündigt sich der erste Schnee an. Grund dafür ist heranströmende Polarluft.,https://img.zeit.de/wissen/umwelt/2025-11/erster-schnee-deutschland-wetter-deutscher-wetterdienst-bild-2/wide__1300x731,2025-11-15T21:58:17Z,,"Der Deutsche Wetterdienst (DWD) hat für Montagmorgen die ersten Schneeflocken in Deutschland angekündigt. Für den Alpen und in den Hochlagen der Mittelgebirge sei damit zu rechnen. ""Man muss kein Pro… [+704 chars]",,de,'Schnee Wetterdienst'
https://www.zeit.de/news/2025-11/16/kommunen-ruesten-sich-fuer-schnee-und-eis-auf-sachsens-strassen,https://www.zeit.de/news/2025-11/16/kommunen-ruesten-sich-fuer-schnee-und-eis-auf-sachsens-strassen,0,www.zeit.de,Winterdienst: Kommunen rüsten sich für Schnee und Eis auf Sachsens Straßen,Hier finden Sie Informationen zu dem Thema „Winterdienst“. Lesen Sie jetzt „Kommunen rüsten sich für Schnee und Eis auf Sachsens Straßen“.,https://img.zeit.de/news/2025-11/16/kommunen-ruesten-sich-fuer-schnee-und-eis-auf-sachsens-strassen-image-group/wide__1300x731,2025-11-16T03:01:07Z,,"Schnee und Eis sind derzeit noch nicht in Sicht - die Kommunen sind aber auf kommende winterliche Verhältnisse vorbereitet. Die Lager für Streumittel sind gefüllt, Schneefangzäune aufgebaut und die F… [+3356 chars]",,de,'Glätte'
https://www.stern.de/gesellschaft/regional/sachsen/winterdienst--kommunen-ruesten-sich-fuer-schnee-und-eis-auf-sachsens-strassen-36551832.html,https://www.stern.de/gesellschaft/regional/sachsen/winterdienst--kommunen-ruesten-sich-fuer-schnee-und-eis-auf-sachsens-strassen-36551832.html,0,www.stern.de,Winterdienst: Kommunen rüsten sich für Schnee und Eis auf Sachsens Straßen,"Streumittel sind eingelagert, Schneezäune aufgestellt und die Fahrer auf den Winterdienst geschult: Sachsens Kommunen sind vorbereitet auf Eis und Schnee. Aber auch Autofahrer sollten achtsam sein.",https://image.stern.de/36551834/t/wz/v1/w1440/r1.7778/-/16--exr5cn7joev7axs2048jpeg---3d2b5644521b62e8.jpg,2025-11-16T03:01:07Z,,"Kopiere den aktuellen Link
Zur Merkliste hinzufügen
Streumittel sind eingelagert, Schneezäune aufgestellt und die Fahrer auf den Winterdienst geschult: Sachsens Kommunen sind vorbereitet auf Eis un… [+3830 chars]",,de,'Schnee Eis'
https://www.zeit.de/news/2025-11/16/lokale-glaette-in-der-nacht-zum-montag,https://www.zeit.de/news/2025-11/16/lokale-glaette-in-der-nacht-zum-montag,0,www.zeit.de,Wetter: Lokale Glätte in der Nacht zum Montag,Hier finden Sie Informationen zu dem Thema „Wetter“. Lesen Sie jetzt „Lokale Glätte in der Nacht zum Montag“.,https://img.zeit.de/news/2025-11/16/lokale-glaette-in-der-nacht-zum-montag-image-group/wide__1300x731,2025-11-16T08:36:23Z,,"Temperaturen von bis zu 14 Grad gibt es in Rheinland-Pfalz und im Saarland. Nach morgendlichem Nebel soll der Tag niederschlagsfrei bleiben, wie der Deutsche Wetterdienst (DWD) mitteilte. In der Nach… [+388 chars]",,de,'Glätte'
https://www.stern.de/panorama/vorhersage--nasskaltes-wetter-zum-wochenstart-und-schnee-in-den-alpen-36552636.html,https://www.stern.de/panorama/vorhersage--nasskaltes-wetter-zum-wochenstart-und-schnee-in-den-alpen-36552636.html,0,www.stern.de,Vorhersage: Nasskaltes Wetter zum Wochenstart und Schnee in den Alpen,"Endlich etwas Schnee! Aber die nassen Flocken bleiben nicht liegen, kündigte der Wetterdienst an. Nur im Allgäu muss bereits mit zunehmend winterlichen Straßenverhältnissen gerechnet werden.",https://image.stern.de/36552638/t/ZN/v1/w1440/r1.7778/-/16--5qr7sa2c25v7axs2048jpeg---000d1ba92255aa4a.jpg,2025-11-16T11:43:37Z,,"Kopiere den aktuellen Link
Zur Merkliste hinzufügen
Endlich etwas Schnee! Aber die nassen Flocken bleiben nicht liegen, kündigte der Wetterdienst an. Nur im Allgäu muss bereits mit zunehmend winter… [+1178 chars]",,de,'Schneefall'
https://www.tagesspiegel.de/gesellschaft/panorama/vorhersage-nasskaltes-wetter-zum-wochenstart-und-schnee-in-den-alpen-14854058.html,https://www.tagesspiegel.de/gesellschaft/panorama/vorhersage-nasskaltes-wetter-zum-wochenstart-und-schnee-in-den-alpen-14854058.html,0,www.tagesspiegel.de,Vorhersage: Nasskaltes Wetter zum Wochenstart und Schnee in den Alpen,"Endlich etwas Schnee! Aber die nassen Flocken bleiben nicht liegen, kündigte der Wetterdienst an. Nur im Allgäu muss bereits mit zunehmend winterlichen Straßenverhältnissen gerechnet werden.",https://www.tagesspiegel.de/images/14854055/alternates/BASE_16_9_W1400/1763293522000/nasskaltes-wetter.jpeg,2025-11-16T11:45:22Z,,"Mit Regen, Graupel- und Schneeschauern muss zum Start in die neue Woche gerechnet werden. Es gibt nasskaltes Wetter, kündigt Meteorologe Helge Tuschy vom Deutschen Wetterdienst (DWD) an. Die nassen F… [+1026 chars]",,de,'Schneefall'
https://www.stern.de/wetter--diese-karten-zeigen--wo-kommende-woche-schnee-faellt-36552640.html,https://www.stern.de/wetter--diese-karten-zeigen--wo-kommende-woche-schnee-faellt-36552640.html,0,www.stern.de,Wetter: Hier soll es kommende Woche schneien – Live-Karten zeigen die Wetterlage,"Endlich etwas Schnee! Aber die nassen Flocken bleiben nicht liegen, kündigte der Wetterdienst an. Die untenstehenden Karten zeigen, wo mit der weißen Pracht zu rechnen ist.",https://image.stern.de/36552658/t/qD/v1/w1440/r1.7778/-/wetter-deutschland-niederschlag.jpg,2025-11-16T13:03:00Z,,"Kopiere den aktuellen Link
Zur Merkliste hinzufügen
Endlich etwas Schnee! Aber die nassen Flocken bleiben nicht liegen, kündigte der Wetterdienst an. Die untenstehenden Karten zeigen, wo mit der we… [+1707 chars]",,de,'Schnee Wetterlage'
https://www.bild.de/news/wetter/wo-schnee-faellt-wo-es-glatt-wird-achtung-polar-peitsche-69199b0c48c8e4de26557a78,https://www.bild.de/news/wetter/wo-schnee-faellt-wo-es-glatt-wird-achtung-polar-peitsche-69199b0c48c8e4de26557a78,0,www.bild.de,"Wo es glatt wird, wo Schnee fällt - Achtung, Polar-Peitsche!",Die Zeichen stehen auf Winter und weiße Flocken. In der Nacht zum Montag sinkt die Schneefallgrenze.,"https://images.bild.de/69199b0c48c8e4de26557a78/1f91a5ac2a1255753b64a5b342064ad3,8c83c7b?w=1280",2025-11-16T14:07:19Z,,"Die Zeichen stehen auf Winter und weiße Flocken. In der Nacht zum Montag sinkt die Schneefallgrenze. Es wird in den höheren Lagen glatt und die Temperaturen fallen.
Am Montag dringt die polare Kaltl… [+3451 chars]",,de,'Schneefall'
https://www.zeit.de/news/2025-11/17/schnee-und-glaette-in-mitteldeutschland,https://www.zeit.de/news/2025-11/17/schnee-und-glaette-in-mitteldeutschland,0,www.zeit.de,Wetter: Schnee und Glätte in Mitteldeutschland,Hier finden Sie Informationen zu dem Thema „Wetter“. Lesen Sie jetzt „Schnee und Glätte in Mitteldeutschland“.,https://img.zeit.de/news/2025-11/17/schnee-und-glaette-in-mitteldeutschland-image-group/wide__1300x731,2025-11-17T05:07:51Z,,"Auf wechselhaftes Wetter können sich die Menschen in Mitteldeutschland einstellen auch mit Schnee ist in bergigen Regionen zu rechnen. Auf den Harz, das Erzgebirge und auch die thüringischen Höhen ko… [+507 chars]",,de,'Glätte'
https://www.stern.de/gesellschaft/regional/rheinland-pfalz-saarland/wetter--faellt-der-erste-schnee--36553824.html,https://www.stern.de/gesellschaft/regional/rheinland-pfalz-saarland/wetter--faellt-der-erste-schnee--36553824.html,0,www.stern.de,Wetter: Fällt der erste Schnee?,Offenbach (lrs) - Fällt heute im Westen der erste Schnee? In den Morgenstunden ist es in Rheinland-Pfalz und dem Saarland örtlich neblig. Zeitweise gibt,https://image.stern.de/36553826/t/H5/v1/w1440/r1.7778/-/17--sofm26r5olv5axs2048jpeg---2bc4694eec267774.jpg,2025-11-17T05:56:51Z,,"Kopiere den aktuellen Link
Zur Merkliste hinzufügen
In Lagen über 600 Metern kann es weiß werden. Auf dem Weg zur Arbeit ist Vorsicht angebracht.
Fällt heute im Westen der erste Schnee? In den Mor… [+580 chars]",,de,'Frost'
https://www.zeit.de/news/2025-11/17/unbestaendiges-wetter-und-glaettegefahr-in-norddeutschland,https://www.zeit.de/news/2025-11/17/unbestaendiges-wetter-und-glaettegefahr-in-norddeutschland,0,www.zeit.de,Wetter: Unbeständiges Wetter und Glättegefahr in Norddeutschland,Hier finden Sie Informationen zu dem Thema „Wetter“. Lesen Sie jetzt „Unbeständiges Wetter und Glättegefahr in Norddeutschland“.,https://img.zeit.de/news/2025-11/17/unbestaendiges-wetter-und-glaettegefahr-in-norddeutschland-image-group/wide__1300x731,2025-11-17T06:04:08Z,,Die Menschen in Norddeutschland müssen sich zum Wochenstart auf windiges und eher ungemütliches Wetter einstellen. Laut der Vorhersage des Deutschen Wetterdienstes (DWD) wechseln sich am Montag Schau… [+1650 chars],,de,'Glätte'
https://www.stern.de/gesellschaft/regional/bayern/wettervorhersage--schneeflocken-in-bayern-erwartet-36553910.html,https://www.stern.de/gesellschaft/regional/bayern/wettervorhersage--schneeflocken-in-bayern-erwartet-36553910.html,0,www.stern.de,Wettervorhersage: Schneeflocken in Bayern erwartet,Mit dem Wochenbeginn werden im Freistaat die ersten Schneeflocken erwartet. Auch in tieferen Lagen können Flocken fallen. Wo sich die Menschen auf die weißen Eiskristalle freuen können.,https://image.stern.de/36553912/t/FN/v1/w1440/r1.7778/-/17--m4xk6qmhrgv4axs2048jpeg---b4da052fbcfc9bab.jpg,2025-11-17T06:09:45Z,,"Kopiere den aktuellen Link
Zur Merkliste hinzufügen
Mit dem Wochenbeginn werden im Freistaat die ersten Schneeflocken erwartet. Auch in tieferen Lagen können Flocken fallen. Wo sich die Menschen au… [+1241 chars]",,de,'Schnee Eis'
https://www.zeit.de/news/2025-11/17/kalte-tage-voraus-glaette-und-schauer-im-norden-erwartet,https://www.zeit.de/news/2025-11/17/kalte-tage-voraus-glaette-und-schauer-im-norden-erwartet,0,www.zeit.de,Wetter: Kalte Tage voraus - Glätte und Schauer im Norden erwartet,Hier finden Sie Informationen zu dem Thema „Wetter“. Lesen Sie jetzt „Kalte Tage voraus - Glätte und Schauer im Norden erwartet“.,https://img.zeit.de/news/2025-11/17/kalte-tage-voraus-glaette-und-schauer-im-norden-erwartet-image-group/wide__1300x731,2025-11-17T06:58:42Z,,"Niedersachsen und Bremen starten mit wechselhaftem und ungemütlichem Wetter in die neue Woche. Laut der Vorhersage des Deutschen Wetterdienstes (DWD) bleibt es am Montag wechselnd bewölkt, immer wied… [+1824 chars]",,de,'Glätte'
https://www.zeit.de/news/2025-11/17/erste-schneeflocken-im-sauerland-warnung-vor-glaette,https://www.zeit.de/news/2025-11/17/erste-schneeflocken-im-sauerland-warnung-vor-glaette,0,www.zeit.de,Wetter: Erste Schneeflocken im Sauerland - Warnung vor Glätte,Hier finden Sie Informationen zu dem Thema „Wetter“. Lesen Sie jetzt „Erste Schneeflocken im Sauerland - Warnung vor Glätte“.,https://img.zeit.de/news/2025-11/17/erste-schneeflocken-im-sauerland-warnung-vor-glaette-image-group/wide__1300x731,2025-11-17T07:19:49Z,,"Nach einem kalten Start in die neue Woche sind im Sauerland die ersten Schneeflocken gefallen - und es gibt eine Glättewarnung. 
Der Niederschlag sei am Montagmorgen in Schnee übergegangen, teilte e… [+757 chars]",,de,'Glätte'
https://www.nzz.ch/wirtschaft/kompass-schnee-neuer-plan-fuer-schweizer-wintertourismus-im-klimawandel-ld.1912185,https://www.nzz.ch/wirtschaft/kompass-schnee-neuer-plan-fuer-schweizer-wintertourismus-im-klimawandel-ld.1912185,0,www.nzz.ch,Strategien für eine Welt ohne Schnee: So wollen Schweizer Skigebiete den Klimawandel überleben,"Genug Schnee, wenig Schnee, kein Schnee: Das sind die drei Szenarien für die Bergregionen in den kommenden Jahrzehnten. Jetzt hilft ihnen die Wissenschaft.","https://img.nzz.ch/2025/11/17/57f3fcad-1e43-4ecd-a05e-b62631f368cf.jpg?width=1200&height=675&fit=bounds&quality=75&auto=webp&crop=8092,4552,x0,y156&wmark=nzz",2025-11-17T17:10:11Z,,"Genug Schnee, wenig Schnee, kein Schnee: Das sind die drei Szenarien für die Bergregionen in den kommenden Jahrzehnten. Jetzt hilft ihnen die Wissenschaft.
Eric Matt17.11.2025, 18.10 Uhr
Skifahren,… [+4941 chars]",,de,'Schnee Klimawandel'
https://orf.at/stories/3411746/,https://orf.at/stories/3411746/,0,orf.at,Kälteeinbruch mit etwas Schnee und Frost,"Nass, kalt, unbeständig: Durchaus passend zur Jahreszeit kehren winterliche Bedingungen in Österreich ein. Während es am Montag vielerorts stark geregnet hat, sinkt die Schneefallgrenze in der Nacht auf Dienstag nördlich der Alpen bis in tiefe Lagen. Nennensw…",https://ibs.orf.at/news?image=https%3A%2F%2Fassets.orf.at%2Fmims%2F2025%2F47%2F30%2Fcrops%2Fw%3D1200%2Ch%3D630%2Cq%3D75%2F2836092_master_1094930_wetter_november_kaelte_hum.jpg%3Fs%3D584011eff67b54b398c87dda36d0cd0cef1862a1,2025-11-17T20:20:05Z,,Die vergangene Woche stand noch ganz im Zeichen von typischem Herbstwetter. Eine Inversionswetterlage mit kalter Nebelluft im Flachland sowie warmer und trockener Luft darüber sorgte an einigen Messs… [+2866 chars],,de,'Schneefall'
https://www.tagesspiegel.de/gesellschaft/panorama/wetter-schneefall-in-mittelgebirgen-und-alpen-14869766.html,https://www.tagesspiegel.de/gesellschaft/panorama/wetter-schneefall-in-mittelgebirgen-und-alpen-14869766.html,0,www.tagesspiegel.de,Wetter: Schneefall in Mittelgebirgen und Alpen,Temperaturen um den Gefrierpunkt lassen erste Flocken fallen. In manchen Regionen kommen sogar schon Schneeschieber zum Einsatz.,https://www.tagesspiegel.de/images/14869763/alternates/BASE_16_9_W1400/1763437935000/erster-schnee-im-sauerland.jpeg,2025-11-18T03:52:15Z,,In einigen Teilen Deutschlands hat es am Montag und in der Nacht zu Dienstag geschneit. Nach Angaben des Deutschen Wetterdienstes (DWD) fielen die Flocken sowohl in den Alpen und im Alpenvorland als … [+788 chars],,de,'Schneefall'
https://www.zeit.de/news/2025-11/18/frost-und-glaette-am-morgen-im-suedwesten,https://www.zeit.de/news/2025-11/18/frost-und-glaette-am-morgen-im-suedwesten,0,www.zeit.de,Wettervorhersage: Frost und Glätte am Morgen im Südwesten,Hier finden Sie Informationen zu dem Thema „Wettervorhersage“. Lesen Sie jetzt „Frost und Glätte am Morgen im Südwesten“.,https://img.zeit.de/news/2025-11/18/frost-und-glaette-am-morgen-im-suedwesten-image-group/wide__1300x731,2025-11-18T05:19:27Z,,"Wer in Baden-Württemberg heute früh unterwegs ist, kann sich auf glatte Straßen einstellen. Viele Autofahrer dürften auch den Eiskratzer brauchen. Der Deutsche Wetterdienst (DWD) rechnet am Morgen ve… [+1694 chars]",,de,'Glätte'
https://www.stern.de/gesellschaft/regional/bayern/wetter--frost-und-schnee-sorgen-fuer-glatte-strassen-in-bayern-36557442.html,https://www.stern.de/gesellschaft/regional/bayern/wetter--frost-und-schnee-sorgen-fuer-glatte-strassen-in-bayern-36557442.html,0,www.stern.de,Wetter: Frost und Schnee sorgen für glatte Straßen in Bayern,"Glatte Straßen und frischer Schnee prägen den Morgen in Bayern. Wo Sonne erwartet wird und wo Frost und Wolken dominieren, zeigt der aktuelle Wetterbericht.",https://image.stern.de/36557444/t/2s/v1/w1440/r1.7778/-/18--4e2wkaplswv8axs2048jpeg---4322cf6b8ae68587.jpg,2025-11-18T05:26:34Z,,"Kopiere den aktuellen Link
Zur Merkliste hinzufügen
Glatte Straßen und frischer Schnee prägen den Morgen in Bayern. Wo Sonne erwartet wird und wo Frost und Wolken dominieren, zeigt der aktuelle Wet… [+872 chars]",,de,'glatte Straßen'
https://www.zeit.de/news/2025-11/18/frost-und-schnee-sorgen-fuer-glatte-strassen-in-bayern,https://www.zeit.de/news/2025-11/18/frost-und-schnee-sorgen-fuer-glatte-strassen-in-bayern,0,www.zeit.de,Wetter: Frost und Schnee sorgen für glatte Straßen in Bayern,Hier finden Sie Informationen zu dem Thema „Wetter“. Lesen Sie jetzt „Frost und Schnee sorgen für glatte Straßen in Bayern“.,https://img.zeit.de/news/2025-11/18/frost-und-schnee-sorgen-fuer-glatte-strassen-in-bayern-image-group/wide__1300x731,2025-11-18T05:26:34Z,,"Frost und mancherorts Schneefall haben am Morgen in weiten Teilen Bayerns für glatte Straßen gesorgt. Weiße Flocken kamen vor allem in Mittelgebirgsraum und in den Alpen herunter, wie es vom Deutsche… [+700 chars]",,de,'Frost'
https://www.bild.de/leben-wissen/auto/vereiste-autoscheiben-was-hilft-welche-fehler-sie-vermeiden-sollten-6756a8eb127cdf4f3830ab61,https://www.bild.de/leben-wissen/auto/vereiste-autoscheiben-was-hilft-welche-fehler-sie-vermeiden-sollten-6756a8eb127cdf4f3830ab61,0,www.bild.de,"So machen Sie Ihr Auto blitzschnell eisfrei - Frost! Jetzt heißt es wieder kratzen, frieren, fluchen","Vereiste Autoscheiben nerven alle Bordsteinparker, aber dient der Sicherheit und schützt vor Strafen. BILD gibt Tipps und nennt die größten Fehler","https://images.bild.de/6756a8eb127cdf4f3830ab61/127377530ff246185385b2df6f6142a1,e2c96e6d?w=1280",2025-11-18T10:13:12Z,,"TTS-Player überspringenArtikel weiterlesenBibbern, kratzen, fluchen der Winter ist da! Über Nacht hat ein eisiges Tief Polarluft ins Land gedrückt. In vielen Regionen fällt das Thermometer unter null… [+2660 chars]",,de,'Frost'
